{
  "schema_version": "9709_math_enrichment_v3",
  "paper_code": "9709_m19_32",
  "question_id": "9709_m19_32_q1",
  "question_num": 1,
  "subject_code": "9709",
  "component": "P3",
  "year": 2019,
  "session": "Feb/March",
  "variant": "32",
  "difficulty": 3,
  "numerical_values_checked": false,
  "parts": [
    {
      "part_id": "9709_m19_32_q1_i",
      "difficulty": 3,
      "practice_tier": "mandatory",
      "mapping": {
        "topic_id": "9709_p3_t_logarithmic_and_exponential_functions",
        "module_id": "9709_p3_t_logarithmic_and_exponential_functions_m01",
        "lesson_id": "9709_p3_t_logarithmic_and_exponential_functions_m01_l01"
      },
      "skills": {
        "primary_skill_id": "9709_p3_skill_solving_exponential_and_logarithmic_equations",
        "skill_tags": [
          "Solving Exponential and Logarithmic Equations"
        ]
      },
      "question_pattern_ids": [
        "9709_p3_pattern_solve_equation",
        "9709_p3_pattern_prove_or_show"
      ],
      "knowledge_refs": {
        "formula_ids": [],
        "identity_ids": [],
        "method_ids": [
          "9709_p3_method_solving_exponential_and_logarithmic_equations"
        ],
        "fact_ids": [
          "9709_p3_fact_log_domain"
        ]
      },
      "hints": [
        "Use logarithm laws to combine the two logarithmic terms before removing the base-10 logarithm.",
        "Rewrite $2$ as $\\log_{10}100$, then bring $\\log_{10}x$ to the left.",
        "Equate the resulting product $x(x-4)$ to $100$ and expand into quadratic form."
      ],
      "walkthrough": [
        "Start with the given logarithmic equation:\n$$\\log_{10}(x - 4) = 2 - \\log_{10} x$$",
        "Collect all logarithmic terms on the left-hand side by adding $\\log_{10} x$ to both sides:\n$$\\log_{10}(x - 4) + \\log_{10} x = 2$$",
        "Apply the product rule for logarithms, $\\log_{10} A + \\log_{10} B = \\log_{10}(AB)$:\n$$\\log_{10}\\bigl(x(x - 4)\\bigr) = 2$$",
        "Rewrite the constant $2$ as a base-10 logarithm, $2 = \\log_{10}(10^2) = \\log_{10} 100$, or convert directly into exponential form using the definition of logarithm:\n$$x(x - 4) = 10^2$$\n$$x(x - 4) = 100$$",
        "Expand the left-hand side by distributing $x$:\n$$x^2 - 4x = 100$$",
        "Subtract $100$ from both sides to form a standard quadratic equation:\n$$x^2 - 4x - 100 = 0$$\nThis shows that the equation can be written as a quadratic equation in $x$."
      ],
      "checking": {
        "mode": "ai",
        "ai_rubric": {
          "Solving Exponential and Logarithmic Equations": "Applies the law for the logarithm of a product or quotient; Applies $\\log_{10}100=2$ or $10^2=100$; Derives $x^2-4x-100=0$, or equivalent."
        },
        "criteria_source": "mark_scheme_structured"
      }
    },
    {
      "part_id": "9709_m19_32_q1_ii",
      "difficulty": 2,
      "practice_tier": "mandatory",
      "mapping": {
        "topic_id": "9709_p3_t_logarithmic_and_exponential_functions",
        "module_id": "9709_p3_t_logarithmic_and_exponential_functions_m01",
        "lesson_id": "9709_p3_t_logarithmic_and_exponential_functions_m01_l01"
      },
      "skills": {
        "primary_skill_id": "9709_p3_skill_solving_exponential_and_logarithmic_equations",
        "skill_tags": [
          "Solving Exponential and Logarithmic Equations"
        ]
      },
      "question_pattern_ids": [
        "9709_p3_pattern_solve_equation",
        "9709_p3_pattern_numerical_approximation",
        "9709_p3_pattern_multi_part_dependency"
      ],
      "knowledge_refs": {
        "formula_ids": [],
        "identity_ids": [],
        "method_ids": [
          "9709_p3_method_solving_exponential_and_logarithmic_equations"
        ],
        "fact_ids": [
          "9709_p3_fact_log_domain"
        ]
      },
      "hints": [
        "Use the quadratic equation obtained in part (i), then check solutions against the logarithm domains.",
        "Solve $x^2-4x-100=0$ using the quadratic formula.",
        "Because both $x$ and $x-4$ must be positive, discard any inadmissible root before rounding to 3 significant figures."
      ],
      "walkthrough": [
        "Solve the quadratic equation obtained in part (i):\n$$x^2 - 4x - 100 = 0$$\nIdentify the coefficients: $a = 1$, $b = -4$, and $c = -100$.",
        "Apply the quadratic formula $x = \\dfrac{-b \\pm \\sqrt{b^2 - 4ac}}{2a}$:\n$$x = \\dfrac{-(-4) \\pm \\sqrt{(-4)^2 - 4(1)(-100)}}{2(1)}$$\n$$x = \\dfrac{4 \\pm \\sqrt{16 + 400}}{2} = \\dfrac{4 \\pm \\sqrt{416}}{2}$$",
        "Simplify the radical using $\\sqrt{416} = \\sqrt{16 \\times 26} = 4\\sqrt{26}$:\n$$x = \\dfrac{4 \\pm 4\\sqrt{26}}{2} = 2 \\pm 2\\sqrt{26}$$",
        "Evaluate the two potential numerical roots:\n$$x_1 = 2 + 2\\sqrt{26} \\approx 2 + 2(5.099020) = 2 + 10.198039 = 12.198039$$\n$$x_2 = 2 - 2\\sqrt{26} \\approx 2 - 2(5.099020) = 2 - 10.198039 = -8.198039$$",
        "Check against the domain of the original logarithmic terms $\\log_{10}(x - 4)$ and $\\log_{10} x$:\nThe arguments of logarithms must be strictly positive, requiring $x > 0$ and $x - 4 > 0$, so $x > 4$.\nSince $x_2 \\approx -8.20 < 4$, it is extraneous and rejected.",
        "Round the valid root $x = 12.198039\\dots$ to 3 significant figures:\n$$x \\approx 12.2$$"
      ],
      "checking": {
        "mode": "ai",
        "ai_rubric": {
          "Solving Exponential and Logarithmic Equations": "Solving a 3-term quadratic equation. Gives $12.2$. The final result is $x=12.2$ (3 s.f.)."
        },
        "criteria_source": "mark_scheme_structured"
      }
    }
  ]
}
