{
  "schema_version": "9709_math_enrichment_v3",
  "paper_code": "9709_w24_42",
  "question_id": "9709_w24_42_q7",
  "question_num": 7,
  "subject_code": "9709",
  "component": "M1",
  "year": 2024,
  "session": "Oct/Nov",
  "variant": "42",
  "difficulty": 5,
  "numerical_values_checked": false,
  "parts": [
    {
      "part_id": "9709_w24_42_q7_a",
      "difficulty": 4,
      "practice_tier": "revision",
      "mapping": {
        "topic_id": "9709_m1_t_newton_s_laws_of_motion",
        "module_id": "9709_m1_t_newton_s_laws_of_motion_m03",
        "lesson_id": "9709_m1_t_newton_s_laws_of_motion_m03_l02"
      },
      "skills": {
        "primary_skill_id": "9709_m1_skill_applying_newton_s_second_law",
        "skill_tags": [
          "Applying Newton's Second Law"
        ]
      },
      "question_pattern_ids": [
        "9709_m1_pattern_connected_particles_pulley"
      ],
      "knowledge_refs": {
        "formula_ids": [
          "9709_m1_formula_newton_second_law",
          "9709_m1_formula_weight_inclined_plane",
          "9709_m1_formula_friction_limiting"
        ],
        "identity_ids": [],
        "method_ids": [
          "9709_m1_method_applying_newton_s_second_law",
          "9709_m1_method_using_friction_relationships"
        ],
        "fact_ids": [
          "9709_m1_fact_friction_opposes_motion"
        ]
      },
      "hints": [
        "Draw free-body diagrams for particle A on the inclined plane and particle B hanging vertically below the pulley at the bottom of the plane.",
        "Resolve perpendicular to the plane for A to find normal reaction $R = m_A g \\cos \\theta$, and calculate limiting friction $F = \\mu R$.",
        "Form Newton's second law equations for A moving down the incline ($T + m_A g \\sin \\theta - F = m_A a$) and B moving vertically down ($m_B g - T = m_B a$), then solve simultaneously for $a$ and $T$."
      ],
      "walkthrough": [
        "Calculate normal reaction $R$ on particle A ($0.2\\text{ kg}$) on the plane inclined at $\\sin \\theta = 0.6$ (so $\\cos \\theta = 0.8$):\n$$R = 0.2g \\cos \\theta = 0.2 \\times 10 \\times 0.8 = 1.6\\text{ N}$$",
        "Calculate the limiting friction force using coefficient $\\mu = 1.125$:\n$$F = \\mu R = 1.125 \\times 1.6 = 1.8\\text{ N}$$",
        "Write Newton's second law down the plane for particle A, pulled towards the bottom pulley by tension $T$:\n$$T + 0.2g \\sin \\theta - F = 0.2a \\implies T + 1.2 - 1.8 = 0.2a \\implies T - 0.6 = 0.2a$$",
        "Write Newton's second law vertically downwards for particle B ($0.3\\text{ kg}$):\n$$0.3g - T = 0.3a \\implies 3 - T = 0.3a$$",
        "Add the two equations to solve for acceleration $a$:\n$$(3 - T) + (T - 0.6) = 0.3a + 0.2a \\implies 2.4 = 0.5a \\implies a = \\frac{2.4}{0.5} = 4.8\\text{ m s}^{-2}$$",
        "Substitute $a = 4.8\\text{ m s}^{-2}$ into the equation for B to find the tension $T$:\n$$T = 3 - 0.3(4.8) = 3 - 1.44 = 1.56\\text{ N}$$"
      ],
      "teacher_walkthrough": [
        "System configuration: Particle A of mass $m_A = 0.2\\text{ kg}$ lies on a rough plane inclined at angle $\\theta$, where $\\sin \\theta = 0.6$ and $\\cos \\theta = \\sqrt{1 - 0.6^2} = 0.8$.",
        "Particle B of mass $m_B = 0.3\\text{ kg}$ hangs vertically below a smooth pulley at the bottom of the plane.",
        "Step 1: Normal reaction and friction on particle A.\nResolve forces perpendicular to the plane for A:\n$$R = m_A g \\cos \\theta = 0.2(10)(0.8) = 1.6\\text{ N}$$\nSince A is moving down the plane, friction opposes motion and acts up the plane. Limiting friction is:\n$$F = \\mu R = 1.125 \\times 1.6 = 1.8\\text{ N}$$",
        "Step 2: Equations of motion.\nThe string is light and inextensible, and the pulley is smooth, so the tension $T$ is uniform throughout. Both particles have the same magnitude of acceleration $a$.\nFor particle A moving down the plane towards the pulley:\n$$T + m_A g \\sin \\theta - F = m_A a$$\n$$T + 0.2(10)(0.6) - 1.8 = 0.2a$$\n$$T + 1.2 - 1.8 = 0.2a$$\n$$T - 0.6 = 0.2a \\quad \\text{--- (Equation 1)}$$\nFor particle B hanging below the pulley and accelerating downwards:\n$$m_B g - T = m_B a$$\n$$0.3(10) - T = 0.3a$$\n$$3 - T = 0.3a \\quad \\text{--- (Equation 2)}$$",
        "Step 3: Solve for acceleration $a$.\nAdd Equation 1 and Equation 2 to eliminate $T$:\n$$(T - 0.6) + (3 - T) = 0.2a + 0.3a$$\n$$2.4 = 0.5a$$\n$$a = \\frac{2.4}{0.5} = 4.8\\text{ m s}^{-2}$$",
        "Step 4: Solve for tension $T$.\nSubstitute $a = 4.8\\text{ m s}^{-2}$ into Equation 1:\n$$T = 0.6 + 0.2(4.8) = 0.6 + 0.96 = 1.56\\text{ N}$$\nCheck with Equation 2: $T = 3 - 0.3(4.8) = 3 - 1.44 = 1.56\\text{ N}$."
      ],
      "checking": {
        "mode": "ai",
        "ai_rubric": {
          "Applying Newton's Second Law": "Forms $T - 0.6 = 0.2a$ and $3 - T = 0.3a$, and solves simultaneously to obtain $a = 4.8\\text{ m s}^{-2}$ and $T = 1.56\\text{ N}$."
        },
        "criteria_source": "mark_scheme_structured"
      }
    },
    {
      "part_id": "9709_w24_42_q7_b",
      "difficulty": 4,
      "practice_tier": "revision",
      "mapping": {
        "topic_id": "9709_m1_t_newton_s_laws_of_motion",
        "module_id": "9709_m1_t_newton_s_laws_of_motion_m03",
        "lesson_id": "9709_m1_t_newton_s_laws_of_motion_m03_l03"
      },
      "skills": {
        "primary_skill_id": "9709_m1_skill_modelling_constant_acceleration_motion",
        "skill_tags": [
          "Modelling Constant Acceleration Motion"
        ]
      },
      "question_pattern_ids": [
        "9709_m1_pattern_connected_particles_pulley",
        "9709_m1_pattern_constant_acceleration_rectilinear"
      ],
      "knowledge_refs": {
        "formula_ids": [
          "9709_m1_formula_suvat_v2_u2_2as",
          "9709_m1_formula_newton_second_law"
        ],
        "identity_ids": [],
        "method_ids": [
          "9709_m1_method_modelling_constant_acceleration_motion",
          "9709_m1_method_applying_newton_s_second_law"
        ],
        "fact_ids": [
          "9709_m1_fact_friction_opposes_motion"
        ]
      },
      "hints": [
        "Determine the speed of the particles when B lands after falling $0.25\\text{ m}$ from rest with acceleration $4.8\\text{ m s}^{-2}$, using $v^2 = u^2 + 2as$.",
        "Once B reaches the ground, the string goes slack ($T = 0$). Set up Newton's second law for particle A to find its new deceleration down the plane.",
        "Use $v_{\\text{final}}^2 = v^2 + 2ad$ to find the extra distance $d$ particle A travels down the plane before stopping, and add $0.25\\text{ m}$ to find the total distance."
      ],
      "walkthrough": [
        "Phase 1: Calculate the speed squared when particle B hits the ground after falling $0.25\\text{ m}$ from rest with $a = 4.8\\text{ m s}^{-2}$:\n$$v^2 = 0 + 2(4.8)(0.25) = 2.4$$",
        "Phase 2: After B lands, the string becomes slack ($T = 0$). Particle A continues moving down the plane subject only to component of weight and friction:\n$$m_A g \\sin \\theta - F = m_A a_2 \\implies 1.2 - 1.8 = 0.2 a_2 \\implies -0.6 = 0.2 a_2 \\implies a_2 = -3\\text{ m s}^{-2}$$",
        "Use $0 = v^2 + 2a_2 d$ to find the distance $d$ travelled by A until it comes to rest:\n$$0 = 2.4 + 2(-3)d \\implies 6d = 2.4 \\implies d = 0.4\\text{ m}$$",
        "Calculate the total distance travelled by particle A down the plane:\n$$s_{\\text{total}} = 0.25 + 0.4 = 0.65\\text{ m}$$"
      ],
      "teacher_walkthrough": [
        "Phase 1 (Connected motion):\nParticle B is initially $0.25\\text{ m}$ above the ground. While the string is taut, particle B accelerates downwards and particle A accelerates down the plane with $a = 4.8\\text{ m s}^{-2}$.\nWhen particle B reaches the ground, both particles have travelled $s_1 = 0.25\\text{ m}$.\nCalculate their speed $v$ at this instant using $v^2 = u^2 + 2as$:\n$$v^2 = 0^2 + 2(4.8)(0.25) = 2.4$$",
        "Phase 2 (Slack string motion):\nWhen B hits the ground, it comes to rest and the string becomes slack, so the tension drops to zero ($T = 0$).\nParticle A continues to slide down the plane with initial speed squared $v^2 = 2.4$.\nThe only forces acting parallel to the plane are:\n1. The component of weight down the plane: $m_A g \\sin \\theta = 1.2\\text{ N}$.\n2. Friction opposing motion up the plane: $F = 1.8\\text{ N}$.\nApply Newton's second law down the plane to particle A:\n$$F_{\\text{net}} = m_A a_2 \\implies 1.2 - 1.8 = 0.2 a_2$$\n$$-0.6 = 0.2 a_2$$\n$$a_2 = -\\frac{0.6}{0.2} = -3\\text{ m s}^{-2}$$\nParticle A experiences a deceleration of $3\\text{ m s}^{-2}$.",
        "Calculate the additional distance $s_2$ that particle A travels down the plane before coming to rest ($v_{\\text{final}} = 0$):\n$$v_{\\text{final}}^2 = v^2 + 2 a_2 s_2$$\n$$0 = 2.4 + 2(-3) s_2$$\n$$6 s_2 = 2.4$$\n$$s_2 = \\frac{2.4}{6} = 0.4\\text{ m}$$",
        "Total distance travelled by particle A from release until it comes to rest:\n$$s_{\\text{total}} = s_1 + s_2 = 0.25 + 0.4 = 0.65\\text{ m}$$"
      ],
      "checking": {
        "mode": "ai",
        "ai_rubric": {
          "Modelling Constant Acceleration Motion": "Calculates $v^2 = 2(4.8)(0.25) = 2.4$, finds deceleration $a_2 = -3\\text{ m s}^{-2}$ after string is slack, evaluates $d = 0.4\\text{ m}$, and obtains total distance $0.65\\text{ m}$."
        },
        "criteria_source": "mark_scheme_structured"
      }
    }
  ]
}
