{
  "schema_version": "9709_math_enrichment_v8",
  "question_id": "9709_m25_32_q7",
  "difficulty": 3,
  "parts": [
    {
      "part_id": "9709_m25_32_q7_a",
      "difficulty": 3,
      "mapping": {
        "topic_id": "9709_p3_t_differentiation",
        "lesson_id": "9709_p3_t_differentiation_m03_l01"
      },
      "hints": [
        "At the interior maximum $x=p$, the derivative of $y=x^3\\cos(2x)$ is zero.",
        "Differentiate with the product and chain rules, then factor out the non-zero power of $p$.",
        "Rearrange the remaining equation into $\\tan(2p)=\\frac{3}{2p}$.",
        "Use $0<p<\\pi/4$ to apply the inverse tangent on the correct branch and obtain the stated fixed-point form."
      ],
      "walkthrough": [
        "Differentiate $y = x^3\\cos(2x)$ with respect to $x$ using the product rule $(uv)' = u'v + uv'$:\n$$u = x^3 \\implies \\dfrac{\\mathrm{d}u}{\\mathrm{d}x} = 3x^2$$\n$$v = \\cos(2x) \\implies \\dfrac{\\mathrm{d}v}{\\mathrm{d}x} = -2\\sin(2x)$$\n$$\\dfrac{\\mathrm{d}y}{\\mathrm{d}x} = 3x^2\\cos(2x) + x^3(-2\\sin(2x)) = 3x^2\\cos(2x) - 2x^3\\sin(2x)$$",
        "Set the derivative equal to $0$ at the stationary point $x = p$:\n$$3p^2\\cos(2p) - 2p^3\\sin(2p) = 0$$\n$$p^2[3\\cos(2p) - 2p\\sin(2p)] = 0$$",
        "Since $0 < p \\leqslant \\dfrac{\\pi}{4}$, $p \\neq 0$, divide by $p^2$ and isolate the trigonometric terms:\n$$3\\cos(2p) - 2p\\sin(2p) = 0$$\n$$2p\\sin(2p) = 3\\cos(2p)$$\n$$\\dfrac{\\sin(2p)}{\\cos(2p)} = \\dfrac{3}{2p} \\implies \\tan(2p) = \\dfrac{3}{2p}$$",
        "Take the inverse tangent of both sides and solve for $p$:\n$$2p = \\tan^{-1}\\left(\\dfrac{3}{2p}\\right)$$\n$$p = \\dfrac{1}{2}\\tan^{-1}\\left(\\dfrac{3}{2p}\\right)$$"
      ]
    },
    {
      "part_id": "9709_m25_32_q7_b",
      "difficulty": 1,
      "mapping": {
        "topic_id": "9709_p3_t_numerical_solution_of_equations",
        "lesson_id": "9709_p3_t_numerical_solution_of_equations_m01_l02"
      },
      "hints": [
        "Turn the result from part (a) into a continuous root function, for example $f(p)=p-\\frac12\\tan^{-1}\\!\\left(\\frac{3}{2p}\\right)$.",
        "Calculate $f(0.5)$ and $f(0.7)$, retaining enough digits to show their signs clearly.",
        "Conclude from the sign change and continuity that a root, and hence the required $p$, lies between the two values."
      ],
      "walkthrough": [
        "Define the continuous function $f(p) = p - \\dfrac{1}{2}\\tan^{-1}\\left(\\dfrac{3}{2p}\\right)$ based on the equation $p = \\dfrac{1}{2}\\tan^{-1}\\left(\\dfrac{3}{2p}\\right)$:\n$$f(p) = p - \\dfrac{1}{2}\\tan^{-1}\\left(\\dfrac{3}{2p}\\right)$$",
        "Evaluate $f(p)$ at $p = 0.5$ in radians with complete arithmetic:\n$$\\dfrac{3}{2(0.5)} = \\dfrac{3}{1.0} = 3$$\n$$\\tan^{-1}(3) \\approx 1.2490458 \\text{ rad}$$\n$$\\dfrac{1}{2}\\tan^{-1}(3) = \\dfrac{1.2490458}{2} = 0.6245229$$\n$$f(0.5) = 0.5 - 0.6245229 = -0.1245229 < 0$$",
        "Evaluate $f(p)$ at $p = 0.7$ in radians with complete arithmetic:\n$$\\dfrac{3}{2(0.7)} = \\dfrac{3}{1.4} = \\dfrac{15}{7} \\approx 2.1428571$$\n$$\\tan^{-1}(2.1428571) \\approx 1.1341904 \\text{ rad}$$\n$$\\dfrac{1}{2}\\tan^{-1}(2.1428571) = \\dfrac{1.1341904}{2} = 0.5670952$$\n$$f(0.7) = 0.7 - 0.5670952 = +0.1329048 > 0$$",
        "State conclusion based on sign change and continuity:\n$$\\text{Since } f(0.5) < 0 \\text{ and } f(0.7) > 0, \\text{ and } f(p) \\text{ is continuous on } [0.5, 0.7],$$\n$$\\text{by the intermediate value theorem there is a root } p \\text{ between } 0.5 \\text{ and } 0.7. \\text{ Hence } 0.5 < p < 0.7.$$"
      ]
    },
    {
      "part_id": "9709_m25_32_q7_c",
      "difficulty": 2,
      "mapping": {
        "topic_id": "9709_p3_t_numerical_solution_of_equations",
        "lesson_id": "9709_p3_t_numerical_solution_of_equations_m02_l02"
      },
      "hints": [
        "Use the fixed-point update $p_{n+1}=\\frac12\\tan^{-1}\\!\\left(\\frac{3}{2p_n}\\right)$, with angles in radians.",
        "Take $p_1=0.5$, calculate $p_2$ from the given update, then feed each output back into the formula; record every iterate to 5 decimal places.",
        "Continue until successive iterates agree sufficiently to justify rounding $p$ to 3 decimal places."
      ],
      "walkthrough": [
        "Set up the iterative formula $p_{n+1} = \\dfrac{1}{2}\\tan^{-1}\\left(\\dfrac{3}{2p_n}\\right)$ with starting value $p_0 = 0.5$ (working in radians):\n$$p_1 = \\dfrac{1}{2}\\tan^{-1}\\left(\\dfrac{3}{2(0.5)}\\right) = \\dfrac{1}{2}\\tan^{-1}(3) = \\dfrac{1.2490458}{2} = 0.62452$$",
        "Calculate the second iterate $p_2$:\n$$\\dfrac{3}{2(0.62452)} = \\dfrac{3}{1.24904} \\approx 2.4018446$$\n$$p_2 = \\dfrac{1}{2}\\tan^{-1}(2.4018446) = \\dfrac{1.1762747}{2} = 0.58814$$",
        "Calculate subsequent iterates giving values to 5 decimal places:\n$$p_3 = \\dfrac{1}{2}\\tan^{-1}\\left(\\dfrac{3}{2(0.58814)}\\right) = \\dfrac{1}{2}\\tan^{-1}(2.5504132) = 0.59856$$\n$$p_4 = \\dfrac{1}{2}\\tan^{-1}\\left(\\dfrac{3}{2(0.59856)}\\right) = \\dfrac{1}{2}\\tan^{-1}(2.5060144) = 0.59556$$\n$$p_5 = \\dfrac{1}{2}\\tan^{-1}\\left(\\dfrac{3}{2(0.59556)}\\right) = \\dfrac{1}{2}\\tan^{-1}(2.5186380) = 0.59642$$\n$$p_6 = \\dfrac{1}{2}\\tan^{-1}\\left(\\dfrac{3}{2(0.59642)}\\right) = \\dfrac{1}{2}\\tan^{-1}(2.5150062) = 0.59617$$",
        "Round the converged value of $p$ to 3 decimal places:\n$$\\text{Since successive iterates round to } 0.596:$$\n$$p = 0.596$$"
      ]
    }
  ]
}
