{
  "schema_version": "9709_math_enrichment_v8",
  "question_id": "9709_w16_63_q5",
  "difficulty": 4,
  "parts": [
    {
      "part_id": "9709_w16_63_q5_i",
      "difficulty": 3,
      "mapping": {
        "topic_id": "9709_s1_t_representation_of_data",
        "lesson_id": "9709_s1_t_representation_of_data_m02_l01"
      },
      "hints": [
        "Calculate the cumulative frequencies at the upper class boundaries for both girls and boys.",
        "For girls, plot points at upper boundaries: (140, 0), (150, 12), (160, 33), (170, 50), (180, 60), (190, 60).",
        "For boys, plot points at upper boundaries: (150, 0), (160, 20), (170, 43), (180, 55), (190, 60).",
        "Draw smooth curves or line segments through the points on the same axes with clear labels for axes and graphs."
      ],
      "walkthrough": [
        "To draw cumulative frequency graphs, always plot the cumulative frequency against the upper class boundary of each interval.",
        "Calculate the cumulative frequencies for Girls ($N = 60$):\n- At height 140: 0\n- At height 150: 12\n- At height 160: $12 + 21 = 33$\n- At height 170: $33 + 17 = 50$\n- At height 180: $50 + 10 = 60$\n- At height 190: 60\nCoordinates for Girls: $(140, 0), (150, 12), (160, 33), (170, 50), (180, 60), (190, 60)$.",
        "Calculate the cumulative frequencies for Boys ($N = 60$):\n- At height 150: 0\n- At height 160: 20\n- At height 170: $20 + 23 = 43$\n- At height 180: $43 + 12 = 55$\n- At height 190: $55 + 5 = 60$\nCoordinates for Boys: $(150, 0), (160, 20), (170, 43), (180, 55), (190, 60)$.",
        "Set up the axes on graph paper:\n- Horizontal axis: 'Height (cm)' from 140 to 190.\n- Vertical axis: 'Cumulative frequency' from 0 to 60.\nPlot the points accurately for each group, connect with a smooth S-curve, and label the two curves 'Girls' and 'Boys'."
      ]
    },
    {
      "part_id": "9709_w16_63_q5_ii",
      "difficulty": 3,
      "mapping": {
        "topic_id": "9709_s1_t_representation_of_data",
        "lesson_id": "9709_s1_t_representation_of_data_m02_l01"
      },
      "hints": [
        "A girl is unable to stand upright in a cave of height 165 cm if her height is strictly greater than 165 cm ($h > 165$).",
        "Read the cumulative frequency for girls at height 165 cm from your graph (approximately 42).",
        "Subtract this value from the total of 60 girls to find how many girls are taller than 165 cm: $60 - 42 = 18$.",
        "Express this count as a percentage of the 60 girls: $\\dfrac{18}{60} \\times 100\\%$."
      ],
      "walkthrough": [
        "The cave ceiling is $165\\text{ cm}$ high. A student will be unable to stand upright if their height is greater than $165\\text{ cm}$.",
        "Step 1: Locate $165\\text{ cm}$ on the horizontal axis of your cumulative frequency diagram and move vertically up to meet the girls' curve.",
        "Step 2: Read across to the vertical cumulative frequency axis. The reading is approximately $42$ girls (acceptable range is $41$ to $43$). This means 42 girls are $165\\text{ cm}$ or shorter.",
        "Step 3: To find how many girls are taller than $165\\text{ cm}$, subtract from the total of 60 girls:\n$$\\text{Girls taller than } 165\\text{ cm} = 60 - 42 = 18$$",
        "Step 4: Convert this count to a percentage:\n$$\\text{Percentage} = \\frac{18}{60} \\times 100\\% = 30\\%$$"
      ]
    },
    {
      "part_id": "9709_w16_63_q5_iii",
      "difficulty": 2,
      "mapping": {
        "topic_id": "9709_s1_t_representation_of_data",
        "lesson_id": "9709_s1_t_representation_of_data_m02_l04"
      },
      "hints": [
        "Consider the key statistical features prominently displayed on a box plot: median, quartiles, and range.",
        "Think about how easy it is to visually compare the medians and spreads directly without reading values from curves.",
        "State clearly that box-and-whisker plots allow immediate visual comparison of central tendency and spread."
      ],
      "walkthrough": [
        "While cumulative frequency graphs display every percentile, parallel box-and-whisker plots summarize the data directly into a five-figure summary.",
        "An advantage of using box-and-whisker plots to compare the groups is that the medians and interquartile ranges are explicitly displayed as lines and boxes. This makes it immediately obvious which group has a higher average height and which group has greater spread, without needing to perform manual lookups on curves."
      ]
    }
  ]
}
