{
  "schema_version": "9709_math_enrichment_v3",
  "paper_code": "9709_s23_31",
  "question_id": "9709_s23_31_q1",
  "question_num": 1,
  "subject_code": "9709",
  "component": "P3",
  "year": 2023,
  "session": "May/June",
  "variant": "31",
  "difficulty": 1,
  "numerical_values_checked": false,
  "parts": [
    {
      "part_id": "9709_s23_31_q1",
      "difficulty": 1,
      "practice_tier": "mandatory",
      "mapping": {
        "topic_id": "9709_p3_t_logarithmic_and_exponential_functions",
        "module_id": "9709_p3_t_logarithmic_and_exponential_functions_m01",
        "lesson_id": "9709_p3_t_logarithmic_and_exponential_functions_m01_l01"
      },
      "skills": {
        "primary_skill_id": "9709_p3_skill_solving_exponential_and_logarithmic_equations",
        "skill_tags": [
          "Solving Exponential and Logarithmic Equations"
        ]
      },
      "question_pattern_ids": [
        "9709_p3_pattern_solve_equation",
        "9709_p3_pattern_numerical_approximation"
      ],
      "knowledge_refs": {
        "formula_ids": [],
        "identity_ids": [],
        "method_ids": [
          "9709_p3_method_solving_exponential_and_logarithmic_equations"
        ],
        "fact_ids": [
          "9709_p3_fact_log_domain"
        ]
      },
      "hints": [
        "Turn the exponential equation into a quadratic by multiplying through by $e^{2x}$ and setting $u=e^{2x}$.",
        "Solve $3u^2-5u-4=0$, remembering that $u=e^{2x}>0$.",
        "Use $2x=\\ln u$ for the admissible root, then round $x$ to 3 decimal places."
      ],
      "walkthrough": [
        "Multiply through by $\\mathrm{e}^{2x}$ to remove the negative exponential:\n$$3\\mathrm{e}^{2x} - 4\\mathrm{e}^{-2x} = 5$$\n$$3(\\mathrm{e}^{2x})^2 - 4 = 5\\mathrm{e}^{2x}$$\n$$3(\\mathrm{e}^{2x})^2 - 5\\mathrm{e}^{2x} - 4 = 0$$",
        "Let $u = \\mathrm{e}^{2x}$, forming a standard quadratic equation in $u$:\n$$3u^2 - 5u - 4 = 0$$",
        "Solve the quadratic equation using the quadratic formula, $u = \\dfrac{-b \\pm \\sqrt{b^2 - 4ac}}{2a}$:\n$$u = \\dfrac{-(-5) \\pm \\sqrt{(-5)^2 - 4(3)(-4)}}{2(3)}$$\n$$u = \\dfrac{5 \\pm \\sqrt{25 + 48}}{6} = \\dfrac{5 \\pm \\sqrt{73}}{6}$$",
        "Select the valid positive root, since $\\mathrm{e}^{2x} > 0$ for all real $x$:\n$$\\sqrt{73} \\approx 8.5440037$$\n$$u = \\dfrac{5 + \\sqrt{73}}{6} \\approx \\dfrac{5 + 8.5440037}{6} = \\dfrac{13.5440037}{6} \\approx 2.2573340$$\n(The root $\\dfrac{5 - \\sqrt{73}}{6} \\approx -0.5907 < 0$ is rejected)",
        "Solve for $x$ by taking the natural logarithm:\n$$\\mathrm{e}^{2x} = \\dfrac{5 + \\sqrt{73}}{6}$$\n$$2x = \\ln\\left(\\dfrac{5 + \\sqrt{73}}{6}\\right) \\approx \\ln(2.2573340) \\approx 0.8141854$$\n$$x = \\dfrac{0.8141854}{2} \\approx 0.4070927$$",
        "Round the final answer correct to 3 decimal places:\n$$x = 0.407$$"
      ],
      "checking": {
        "mode": "ai",
        "ai_rubric": {
          "Solving Exponential and Logarithmic Equations": "Multiplication by $e^{2x}$ gives $3(e^{2x})^2-5e^{2x}-4=0$; its positive root yields $x=\\frac12\\ln[(5+\\sqrt{73})/6]=0.407$."
        },
        "criteria_source": "mark_scheme_structured"
      }
    }
  ]
}
